id,type,setup,punchline
334,general,Why did the coffee file a police report?,It got mugged.
335,general,Why did the cookie cry?,Because his mother was a wafer so long
336,general,Why did the cookie cry?,It was feeling crumby.
337,general,Why did the cowboy have a weiner dog?,Somebody told him to get a long little doggy.
338,general,"Why did the fireman wear red, white, and blue suspenders?",To hold his pants up.
339,general,Why did the girl smear peanut butter on the road?,To go with the traffic jam.
340,general,Why did the half blind man fall in the well?,Because he couldn't see that well!
341,general,Why did the house go to the doctor?,It was having window panes.
342,general,Why did the kid cross the playground?,To get to the other slide.
343,general,Why did the man put his money in the freezer?,He wanted cold hard cash!
344,general,Why did the man run around his bed?,Because he was trying to catch up on his sleep!
345,general,Why did the melons plan a big wedding?,Because they cantaloupe!
346,general,Why did the octopus beat the shark in a fight?,Because it was well armed.
347,general,Why did the opera singer go sailing?,They wanted to hit the high Cs.
348,general,Why did the scarecrow win an award?,Because he was outstanding in his field.
349,general,Why did the tomato blush?,Because it saw the salad dressing.
350,general,Why did the tree go to the dentist?,It needed a root canal.
351,general,Why did the worker get fired from the orange juice factory?,Lack of concentration.
352,general,Why didn't the number 4 get into the nightclub?,Because he is 2 square.
353,general,Why didn’t the orange win the race?,It ran out of juice.
354,general,Why didn’t the skeleton cross the road?,Because he had no guts.
355,general,Why do bananas have to put on sunscreen before they go to the beach?,Because they might peel!
356,general,Why do bears have hairy coats?,Fur protection.
357,general,Why do bees have sticky hair?,Because they use honey combs!
358,general,Why do bees hum?,Because they don't know the words.
359,general,Why do birds fly south for the winter?,Because it's too far to walk.
360,general,Why do choirs keep buckets handy?,So they can carry their tune
361,general,Why do crabs never give to charity?,Because they’re shellfish.
362,general,Why do ducks make great detectives?,They always quack the case.
363,general,Why do mathematicians hate the U.S.?,Because it's indivisible.
364,general,Why do pirates not know the alphabet?,"They always get stuck at ""C""."
365,general,Why do pumpkins sit on people’s porches?,They have no hands to knock on the door.
366,general,Why do scuba divers fall backwards into the water?,Because if they fell forwards they’d still be in the boat.
367,general,Why do trees seem suspicious on sunny days?,"Dunno, they're just a bit shady."
368,general,Why do valley girls hang out in odd numbered groups?,Because they can't even.
369,general,Why do wizards clean their teeth three times a day?,To prevent bat breath!
370,general,Why do you never see elephants hiding in trees?,Because they're so good at it.
371,general,Why does a chicken coop only have two doors?,Because if it had four doors it would be a chicken sedan.
372,general,Why does a Moon-rock taste better than an Earth-rock?,Because it's a little meteor.
373,general,"Why does it take longer to get from 1st to 2nd base, than it does to get from 2nd to 3rd base?",Because there’s a Shortstop in between!
374,general,Why does Norway have barcodes on their battleships?,"So when they get back to port, they can Scandinavian."
375,general,Why does Superman get invited to dinners?,Because he is a Supperhero.
376,general,Why does Waldo only wear stripes?,Because he doesn't want to be spotted.
377,programming,Knock-knock.,A race condition. Who is there?
378,programming,What's the best part about TCP jokes?,I get to keep telling them until you get them.
379,programming,A programmer puts two glasses on his bedside table before going to sleep.,"A full one, in case he gets thirsty, and an empty one, in case he doesn’t."
380,programming,There are 10 kinds of people in this world.,"Those who understand binary, those who don't, and those who weren't expecting a base 3 joke."
381,general,Two guys walk into a bar . . .,"The first guy says ""Ouch!"" and the second says ""Yeah, I didn't see it either."""
382,programming,What did the router say to the doctor?,It hurts when IP.
383,programming,An IPv6 packet is walking out of the house.,He goes nowhere.
384,programming,A DHCP packet walks into a bar and asks for a beer.,"Bartender says, ""here, but I’ll need that back in an hour!"""
385,programming,"3 SQL statements walk into a NoSQL bar. Soon, they walk out",They couldn't find a table.
386,general,I saw a nice stereo on Craigslist for $1. Seller says the volume is stuck on ‘high’,I couldn’t turn it down.
387,general,"My older brother always tore the last pages of my comic books, and never told me why.",I had to draw my own conclusions.
